{
  "$schema": "https://hyperframes.local/schemas/project-state.schema.json",
  "schemaVersion": "1.0.0",
  "revision": 1,
  "state": "INTAKE",
  "previousState": null,
  "stateEnteredAt": "1970-01-01T00:00:00.000Z",
  "transitions": [],
  "gateEvidence": [],
  "invalidations": [],
  "integrity": { "digest": null, "upstream": {} }
}
